{
  "api_version": 1,
  "message_type": "revoke_response",
  "request_id": "ffffffff-ffff-4fff-8fff-ffffffffffff",
  "payload": {
    "device_id": "44444444-4444-4444-8444-444444444444",
    "device_key_id": "55555555-5555-4555-8555-555555555555",
    "revoked": true,
    "effective_at": 1899997000
  }
}
