{
  "api_version": 1,
  "message_type": "register_device_response",
  "request_id": "eeeeeeee-eeee-4eee-8eee-eeeeeeeeeeee",
  "payload": {
    "device_id": "44444444-4444-4444-8444-444444444444",
    "device_key_id": "55555555-5555-4555-8555-555555555555",
    "status": "registered",
    "grant": {
      "grant_id": "66666666-6666-4666-8666-666666666666",
      "tenant_id": "22222222-2222-4222-8222-222222222222",
      "user_id": "33333333-3333-4333-8333-333333333333",
      "device_id": "44444444-4444-4444-8444-444444444444",
      "device_key_id": "55555555-5555-4555-8555-555555555555",
      "issued_at": 1899996400,
      "expires_at": 1900000000,
      "generation": 42,
      "grant_token": "AAAAAAAAAAAAAAAAAAAAAAAAAAAAAAAAAAAAAAAAAAA",
      "signing_key_id": "cloud-policy-2026-01"
    },
    "replayed": false
  }
}
